{
  "schema_version": 1,
  "repository": "atrinik/content",
  "fork": {
    "tag": "v1.8.1",
    "commit": "01b1fdb65c2243df4bafe9c8109fc93229df0121"
  },
  "horizons": {
    "main": "3ebb1710dd90a57779e4e025778f8ed9dec8053e",
    "1.x": "07f9bd418926066503d569b8457175191176434d"
  },
  "terminal_plan": {
    "state": "declared",
    "main": {
      "horizon": "3ebb1710dd90a57779e4e025778f8ed9dec8053e",
      "commits": [
        {
          "ordinal": 1,
          "issue": 137,
          "pull_request": 183,
          "paths": [
            "contracts/release-lines/parity-ledger.json",
            "contracts/release-lines/parity-ledger.schema.json",
            "docs/RELEASE_LINES.md",
            "tools/release_line_parity.py",
            "tools/tests/test_release_line_parity.py",
            "tools/validate.py"
          ]
        },
        {
          "ordinal": 2,
          "issue": 139,
          "pull_request": 185,
          "paths": [
            "docs/RELEASE_LINES.md",
            "tools/release_line_parity.py",
            "tools/tests/test_release_line_parity.py"
          ]
        }
      ]
    },
    "1.x": {
      "horizon": "07f9bd418926066503d569b8457175191176434d",
      "commits": [
        {
          "ordinal": 1,
          "issue": 137,
          "pull_request": 182,
          "paths": [
            "contracts/release-lines/parity-ledger.json",
            "contracts/release-lines/parity-ledger.schema.json",
            "docs/RELEASE_LINES.md",
            "tools/release_line_parity.py",
            "tools/tests/test_release_line_parity.py",
            "tools/validate.py"
          ]
        },
        {
          "ordinal": 2,
          "issue": 139,
          "pull_request": 184,
          "paths": [
            "docs/RELEASE_LINES.md",
            "tools/release_line_parity.py",
            "tools/tests/test_release_line_parity.py"
          ]
        }
      ]
    }
  },
  "outcomes": [
    {
      "id": "outcome-001",
      "issue_repository": "atrinik/content",
      "issue": 41,
      "classification": "exempt",
      "source": [
        {
          "line": "main",
          "commit": "60a3a53c4e3e64293cdba21c91caf0c7a618764d",
          "pull_request": 47
        }
      ],
      "destination": [],
      "domains": [
        "provenance",
        "release",
        "tooling"
      ],
      "prerequisites": [],
      "rationale": "The clean-room provenance registry and replacement release boundary are main-only inputs and must not be copied to Classic content."
    },
    {
      "id": "outcome-002",
      "issue_repository": "atrinik/content",
      "issue": 45,
      "classification": "equivalent",
      "source": [
        {
          "line": "1.x",
          "commit": "1bcdf41d5ee90edd29ad6e11c981e90b24a31778",
          "pull_request": 48
        }
      ],
      "destination": [
        {
          "line": "main",
          "commit": "144c976618bc5cd2d64746e5b1784c5f3800e2a8",
          "pull_request": 49
        }
      ],
      "domains": [
        "guidance",
        "release"
      ],
      "prerequisites": [],
      "rationale": "The paired bootstrap commits establish different branch-native release identities while documenting the same v1.8.1 split."
    },
    {
      "id": "outcome-003",
      "issue_repository": "atrinik/content",
      "issue": 45,
      "classification": "exact",
      "source": [
        {
          "line": "1.x",
          "commit": "7e6b8327d412decfc310666d03ac4f1d06537c47",
          "pull_request": 51
        }
      ],
      "destination": [
        {
          "line": "main",
          "commit": "3b2d4dd7f52187c2752f3b2d3a7370c6205b5c1e",
          "pull_request": 50
        }
      ],
      "domains": [
        "release"
      ],
      "prerequisites": [],
      "rationale": "Both lines received the same semantic-release Node pin as an identical patch."
    },
    {
      "id": "outcome-004",
      "issue_repository": "atrinik/content",
      "issue": 45,
      "classification": "exempt",
      "source": [
        {
          "line": "1.x",
          "commit": "2796dee0b9ac5337bd8b10dd591da124319ffea3",
          "pull_request": 52
        }
      ],
      "destination": [],
      "domains": [
        "release",
        "validation"
      ],
      "prerequisites": [],
      "rationale": "The maintenance-range guard is specific to the 1.x patch channel; main owns the replacement release line."
    },
    {
      "id": "outcome-005",
      "issue_repository": "atrinik/atrinik",
      "issue": 294,
      "classification": "equivalent",
      "source": [
        {
          "line": "1.x",
          "commit": "b769de959028ddcc0c80bc0b35c8206fd4b3a6ba",
          "pull_request": 53
        }
      ],
      "destination": [
        {
          "line": "main",
          "commit": "e0f3797647f13e1b59ab8853151cfb20e9f85b94",
          "pull_request": 54
        }
      ],
      "domains": [
        "guidance"
      ],
      "prerequisites": [],
      "rationale": "Both branches collapse validation guidance to their respective aggregate validator while retaining line-native command details."
    },
    {
      "id": "outcome-006",
      "issue_repository": "atrinik/content",
      "issue": 45,
      "classification": "equivalent",
      "source": [
        {
          "line": "1.x",
          "commit": "89e28ef27d32bddc67e71fac4fa8c847a9dbcbc3",
          "pull_request": 56
        }
      ],
      "destination": [
        {
          "line": "main",
          "commit": "54472d807dafb1c8091f821260f22f6b47c2b28e",
          "pull_request": 55
        }
      ],
      "domains": [
        "guidance",
        "release"
      ],
      "prerequisites": [],
      "rationale": "The release documentation describes the same split from each branch's native consumer and version perspective."
    },
    {
      "id": "outcome-007",
      "issue_repository": "atrinik/content",
      "issue": 58,
      "classification": "exact",
      "source": [
        {
          "line": "1.x",
          "commit": "8b50df52355ae6ae4d529838272e41b5d678c84b",
          "pull_request": 59
        }
      ],
      "destination": [
        {
          "line": "main",
          "commit": "440b45a85603642f6edd37bb5bf45c2034ed0410",
          "pull_request": 60
        }
      ],
      "domains": [
        "validation"
      ],
      "prerequisites": [],
      "rationale": "Both lines received the identical validator restriction for Classic-compatible glow values."
    },
    {
      "id": "outcome-008",
      "issue_repository": "atrinik/content",
      "issue": 66,
      "classification": "equivalent",
      "source": [
        {
          "line": "1.x",
          "commit": "0eea49ef65f21b7b02defda2fdaaf7f8292c17fd",
          "pull_request": 64
        },
        {
          "line": "1.x",
          "commit": "9d5aa3c88becabd33247418af76b2866376ce92b",
          "pull_request": 67
        }
      ],
      "destination": [
        {
          "line": "main",
          "commit": "fde585e2dce52915704fa49608c07e8889f77bf5",
          "pull_request": 124
        }
      ],
      "domains": [
        "authored",
        "guidance",
        "validation"
      ],
      "prerequisites": [
        65
      ],
      "rationale": "The two Classic authoring and audit commits were reconciled into one main port with equivalent authored light assignments and line-native review metadata."
    },
    {
      "id": "outcome-009",
      "issue_repository": "atrinik/content",
      "issue": 57,
      "classification": "exact",
      "source": [
        {
          "line": "1.x",
          "commit": "ead72ef831444c874f65da841498924bab625e99",
          "pull_request": 63
        }
      ],
      "destination": [
        {
          "line": "main",
          "commit": "040e63d96cb50eb1afc8e819297ee3859ad34620",
          "pull_request": 70
        }
      ],
      "domains": [
        "authored"
      ],
      "prerequisites": [],
      "rationale": "The persistent Incuna Sam objective was forward-ported as an identical authored patch."
    },
    {
      "id": "outcome-010",
      "issue_repository": "atrinik/content",
      "issue": 68,
      "classification": "equivalent",
      "source": [
        {
          "line": "1.x",
          "commit": "8576f6dcf1d03ecbcbfa55c80b275568b519491b",
          "pull_request": 72
        }
      ],
      "destination": [
        {
          "line": "main",
          "commit": "e9254f86f2bc54600e67d92f0f826f5bba4984f0",
          "pull_request": 71
        }
      ],
      "domains": [
        "guidance"
      ],
      "prerequisites": [],
      "rationale": "Both branches require paired issue delivery while naming their own checkout and release-line conventions."
    },
    {
      "id": "outcome-011",
      "issue_repository": "atrinik/content",
      "issue": 69,
      "classification": "equivalent",
      "source": [
        {
          "line": "1.x",
          "commit": "348065600579b8517267b4fe79a907b82e197432",
          "pull_request": 74
        }
      ],
      "destination": [
        {
          "line": "main",
          "commit": "50d92776be3431e1da66adb22bf73451160e9f41",
          "pull_request": 73
        }
      ],
      "domains": [
        "runtime",
        "validation"
      ],
      "prerequisites": [],
      "rationale": "Hexadecimal light colors are accepted on both lines with tests adapted to each branch's command runner."
    },
    {
      "id": "outcome-012",
      "issue_repository": "atrinik/content",
      "issue": 62,
      "classification": "equivalent",
      "source": [
        {
          "line": "1.x",
          "commit": "3da37c25c9cc2c9d8bf6cd9761d15d6e73ecb1be",
          "pull_request": 76
        }
      ],
      "destination": [
        {
          "line": "main",
          "commit": "f23cf6603b5b223efaee7ee6e2e9bc1203fc1323",
          "pull_request": 75
        }
      ],
      "domains": [
        "authored",